DOI,PMID,arXiv ID,Title,Abstract,Authors,Journal,Year
10.1186/s40537-022-00659-3,,,"A brief survey on big data: technologies, terminologies and data-intensive applications","Abstract The technical advancements and the availability of massive amounts of data on the Internet draw huge attention from researchers in the areas of decision-making, data sciences, business applications, and government. These massive quantities of data, known as big data, have many benefits and applications for researchers. However, the use of big data consumes a lot of time and imposes enormous computational complexity. This survey describes the significance of big data and its taxonomy and details the basic terminologies used in big data. It also discusses the technologies used in big data applications as well as their various complexities and challenges. The survey focuses on the various techniques presented in the literature to restrain the issues associated with big data. In particular, the review concentrates on big data techniques in accordance with processing, security, and storage. It also discusses the various parameters associated with big data, such as availability and velocity. The study analyses big data terminologies and techniques in accordance with several factors, such as year of publication, performance metrics, achievement of the existing models, and methods utilized. Finally, this review article describes the future direction of research and highlights big data possibilities and solicitations with a detailed sketch of the big data processing frameworks.","Hemn Barzan Abdalla,Hemn Barzan Abdalla",Journal of Big Data,2022
10.1186/s40537-020-00369-8,33169094,,CatBoost for big data: an interdisciplinary review,"Gradient Boosted Decision Trees (GBDT’s) are a powerful tool for classification and regression tasks in Big Data. Researchers should be familiar with the strengths and weaknesses of current implementations of GBDT’s in order to use them effectively and make successful contributions. CatBoost is a member of the family of GBDT machine learning ensemble techniques. Since its debut in late 2018, researchers have successfully used CatBoost for machine learning studies involving Big Data. We take this opportunity to review recent research on CatBoost as it relates to Big Data, and learn best practices from studies that cast CatBoost in a positive light, as well as studies where CatBoost does not outshine other techniques, since we can learn lessons from both types of scenarios. Furthermore, as a Decision Tree based algorithm, CatBoost is well-suited to machine learning tasks involving categorical, heterogeneous data. Recent work across multiple disciplines illustrates CatBoost’s effectiveness and shortcomings in classification and regression tasks. Another important issue we expose in literature on CatBoost is its sensitivity to hyper-parameters and the importance of hyper-parameter tuning. One contribution we make is to take an interdisciplinary approach to cover studies related to CatBoost in a single work. This provides researchers an in-depth understanding to help clarify proper application of CatBoost in solving problems. To the best of our knowledge, this is the first survey that studies all works related to CatBoost in a single publication.","John Hancock,John T. Hancock,Taghi M. Khoshgoftaar,Taghi M. Khoshgoftaar,Taghi M. Khoshgoftaar,Taghi M. Khoshgoftaar,Taghi M. Khoshgoftaar",Journal of Big Data,2020
10.1016/j.jmsy.2021.03.005,,,Big data analytics for intelligent manufacturing systems: A review,,"Junliang Wang,Junliang Wang,Chuqiao Xu,Chuqiao Xu,Jie Zhang,Jie Zhang,Ray Y. Zhong,Ray Y. Zhong,Ray Zhong",Journal of Manufacturing Systems,2021
10.1109/jiot.2020.2998584,,,"IoT, big data and artificial intelligence in agriculture and food industry","Internet of things (IoT) results in massive amount of streaming data, often referred to as “big data”, which brings new opportunities to monitor agricultural and food processes. Besides sensors, big data from social media is also becoming important for the food industry. In this review we present an overview of IoT, big data, and artificial intelligence (AI) and their disruptive role in shaping the future of agri-food systems. Following an introduction to the fields of IoT, big data, and AI, we discuss the role of IoT and big data analysis in agriculture (including greenhouse monitoring, intelligent farm machines, and drone-based crop imaging), supplychain modernization, social media (for open innovation and sentiment analysis) in food industry, food quality assessment (using spectral methods and sensor fusion), and finally, food safety (using gene sequencing and blockchain based digital traceability). A special emphasis is laid on the commercial status of applications and translational research outcomes.","N.N. Misra,N.N. Misra,Yash Dixit,Yash Dixit,Ahmad Al-Mallahi,Ahmad Al-Mallahi,Manreet Bhullar,Manreet Singh Bhullar,Rohit Upadhyay,Rohit Upadhyay,Alex Martynenko,Alex Martynenko",IEEE Internet of Things Journal,2020
10.1016/j.molp.2020.06.009,32585190,,TBtools: An Integrative Toolkit Developed for Interactive Analyses of Big Biological Data.,"Abstract   The rapid development of high-throughput sequencing (HTS) techniques has led biology into the big-data era. Data analyses using various bioinformatics tools rely on programming and command-line environments, which are challenging and time-consuming for most wet-lab biologists. Here, we present TBtools (a Toolkit for Biologists integrating various biological data handling tools), a stand-alone software with a user-friendly interface. The toolkit incorporates over 130 functions, which are designed to meet the increasing demand for big-data analyses, ranging from bulk sequence processing to interactive data visualization. A wide variety of graphs can be prepared in TBtools, with a new plotting engine (“JIGplot”) developed to maximum their interactive ability, which allows quick point-and-click modification to almost every graphic feature.  TBtools is a platform-independent software that can be run under all operating systems with Java Runtime Environment 1.6 or newer. It is freely available to non-commercial users at https://github.com/CJ-Chen/TBtools/releases.","Chengjie Chen,Chengjie Chen,Hao Chen,Hao Chen,Yi Zhang,Yi Zhang,Hannah Thomas,Hannah R. Thomas,Margaret H. Frank,Margaret H. Frank,Yehua He,Yehua He,Yehua He,Rui Xia,Rui Xia",Molecular Plant,2020
,,,"Big data: The next frontier for innovation, competition, and productivity","The amount of data in our world has been exploding, and analyzing large data sets—so-called big data— will become a key basis of competition, underpinning new waves of productivity growth, innovation, and consumer surplus, according to research by MGI and McKinsey's Business Technology Office. Leaders in every sector will have to grapple with the implications of big data, not just a few data-oriented managers. The increasing volume and detail of information captured by enterprises, the rise of multimedia, social media, and the Internet of Things will fuel exponential growth in data for the foreseeable future.","James Manyika,James Manyika",,2011
10.2307/41703503,,,Business intelligence and analytics: from big data to big impact,"Business intelligence and analytics (BI&A) has emerged as an important area of study for both practitioners and researchers, reflecting the magnitude and impact of data-related problems to be solved in contemporary business organizations. This introduction to the MIS Quarterly Special Issue on Business Intelligence Research first provides a framework that identifies the evolution, applications, and emerging research areas of BI&A. BI&A 1.0, BI&A 2.0, and BI&A 3.0 are defined and described in terms of their key characteristics and capabilities. Current research in BI&A is analyzed and challenges and opportunities associated with BI&A research and education are identified. We also report a bibliometric study of critical BI&A publications, researchers, and research topics based on more than a decade of related academic and industry publications. Finally, the six articles that comprise this special issue are introduced and characterized in terms of the proposed BI&A research framework.","Hsinchun Chen,Hsinchun Chen,Roger H. L. Chiang,Roger H. L. Chiang,Veda C. Storey,Veda C. Storey,Veda C. Storey",Management Information Systems Quarterly,2012
,23074865,,Big data: the management revolution.,"Big data, the authors write, is far more powerful than the analytics of the past. Executives can measure and therefore manage more precisely than ever before. They can make better predictions and smarter decisions. They can target more-effective interventions in areas that so far have been dominated by gut and intuition rather than by data and rigor. The differences between big data and analytics are a matter of volume, velocity, and variety: More data now cross the internet every second than were stored in the entire internet 20 years ago. Nearly real-time information makes it possible for a company to be much more agile than its competitors. And that information can come from social networks, images, sensors, the web, or other unstructured sources. The managerial challenges, however, are very real. Senior decision makers have to learn to ask the right questions and embrace evidence-based decision making. Organizations must hire scientists who can find patterns in very large data sets and translate them into useful business information. IT departments have to work hard to integrate all the relevant internal and external sources of data. The authors offer two success stories to illustrate how companies are using big data: PASSUR Aerospace enables airlines to match their actual and estimated arrival times. Sears Holdings directly analyzes its incoming store data to make promotions much more precise and faster.","Andrew McAfee,Erik Brynjolfsson",Harvard Business Review,2012
10.48550/arxiv.2310.20707,,2310.20707,What's In My Big Data?,"Large text corpora are the backbone of language models. However, we have a limited understanding of the content of these corpora, including general statistics, quality, social factors, and inclusion of evaluation data (contamination). In this work, we propose What's In My Big Data? (WIMBD), a platform and a set of sixteen analyses that allow us to reveal and compare the contents of large text corpora. WIMBD builds on two basic capabilities -- count and search -- at scale, which allows us to analyze more than 35 terabytes on a standard compute node. We apply WIMBD to ten different corpora used to train popular language models, including C4, The Pile, and RedPajama. Our analysis uncovers several surprising and previously undocumented findings about these corpora, including the high prevalence of duplicate, synthetic, and low-quality content, personally identifiable information, toxic language, and benchmark contamination. For instance, we find that about 50% of the documents in RedPajama and LAION-2B-en are duplicates. In addition, several datasets used for benchmarking models trained on such corpora are contaminated with respect to important benchmarks, including the Winograd Schema Challenge and parts of GLUE and SuperGLUE. We open-source WIMBD's code and artifacts to provide a standard set of evaluations for new text-based corpora and to encourage more analyses and transparency around them: github.com/allenai/wimbd.","Yanai Elazar,Akshita Bhagia,Ian Magnusson,Abhilasha Ravichander,Dustin Schwenk,Alane Suhr,Pete Walsh,Dirk Groeneveld,Luca Soldaini,Sameer Singh,Hanna Hajishirzi,Noah A. Smith,Jesse Dodge",arXiv.org,2023
10.1016/j.ijinfomgt.2014.10.007,,,Beyond the hype,"We define what is meant by big data.We review analytics techniques for text, audio, video, and social media data.We make the case for new statistical techniques for big data.We highlight the expected future developments in big data analytics. Size is the first, and at times, the only dimension that leaps out at the mention of big data. This paper attempts to offer a broader definition of big data that captures its other unique and defining characteristics. The rapid evolution and adoption of big data by industry has leapfrogged the discourse to popular outlets, forcing the academic press to catch up. Academic journals in numerous disciplines, which will benefit from a relevant discussion of big data, have yet to cover the topic. This paper presents a consolidated description of big data by integrating definitions from practitioners and academics. The paper's primary focus is on the analytic methods used for big data. A particular distinguishing feature of this paper is its focus on analytics related to unstructured data, which constitute 95% of big data. This paper highlights the need to develop appropriate and efficient analytical methods to leverage massive volumes of heterogeneous data in unstructured text, audio, and video formats. This paper also reinforces the need to devise new tools for predictive analytics for structured big data. The statistical methods in practice were devised to infer from sample data. The heterogeneity, noise, and the massive size of structured big data calls for developing computationally efficient algorithms that may avoid big data pitfalls, such as spurious correlation.","Amir H. Gandomi,Amir H. Gandomi,Murtaza Haider,Murtaza Haider",International Journal of Information Management,2015
,,2104.05704,Escaping the Big Data Paradigm with Compact Transformers,"With the rise of Transformers as the standard for language processing, and their advancements in computer vision, there has been a corresponding growth in parameter size and amounts of training data. Many have come to believe that because of this, transformers are not suitable for small sets of data. This trend leads to concerns such as: limited availability of data in certain scientific domains and the exclusion of those with limited resource from research in the field. In this paper, we aim to present an approach for small-scale learning by introducing Compact Transformers. We show for the first time that with the right size, convolutional tokenization, transformers can avoid overfitting and outperform state-of-the-art CNNs on small datasets. Our models are flexible in terms of model size, and can have as little as 0.28M parameters while achieving competitive results. Our best model can reach 98% accuracy when training from scratch on CIFAR-10 with only 3.7M parameters, which is a significant improvement in data-efficiency over previous Transformer based models being over 10x smaller than other transformers and is 15% the size of ResNet50 while achieving similar performance. CCT also outperforms many modern CNN based approaches, and even some recent NAS-based approaches. Additionally, we obtain a new SOTA result on Flowers-102 with 99.76% top-1 accuracy, and improve upon the existing baseline on ImageNet (82.71% accuracy with 29% as many parameters as ViT), as well as NLP tasks. Our simple and compact design for transformers makes them more feasible to study for those with limited computing resources and/or dealing with small datasets, while extending existing research efforts in data efficient transformers. Our code and pre-trained models are publicly available at https://github.com/SHI-Labs/Compact-Transformers.","Ali Hassani,Steven Walton,Nikhil Shah,Abulikemu Abuduweili,Jiachen Li,Humphrey Shi",arXiv.org,2021
10.25195/ijci.v49i1.384,,,Big Data Analytics: A Survey,"Internet-based programs and communication techniques have become widely used and respected in the IT industry recently. A persistent source of ""big data,"" or data that is enormous in volume, diverse in type, and has a complicated multidimensional structure, is internet applications and communications. Today, several measures are routinely performed with no assurance that any of them will be helpful in understanding the phenomenon of interest in an era of automatic, large-scale data collection. Online transactions that involve buying, selling, or even investing are all examples of e-commerce. As a result, they generate data that has a complex structure and a high dimension. The usual data storage techniques cannot handle those enormous volumes of data. There is a lot of work being done to find ways to minimize the dimensionality of big data in order to provide analytics reports that are even more accurate and data visualizations that are more interesting. As a result, the purpose of this survey study is to give an overview of big data analytics along with related problems and issues that go beyond technology.","Wasnaa Kadhim Jawad,Abbas M. Al-Bakry",Iraqi Journal for Computers and Informatics,2022
10.1186/s40537-021-00553-4,35013701,,The use of Big Data Analytics in healthcare,"Abstract The introduction of Big Data Analytics (BDA) in healthcare will allow to use new technologies both in treatment of patients and health management. The paper aims at analyzing the possibilities of using Big Data Analytics in healthcare. The research is based on a critical analysis of the literature, as well as the presentation of selected results of direct research on the use of Big Data Analytics in medical facilities. The direct research was carried out based on research questionnaire and conducted on a sample of 217 medical facilities in Poland. Literature studies have shown that the use of Big Data Analytics can bring many benefits to medical facilities, while direct research has shown that medical facilities in Poland are moving towards data-based healthcare because they use structured and unstructured data, reach for analytics in the administrative, business and clinical area. The research positively confirmed that medical facilities are working on both structural data and unstructured data. The following kinds and sources of data can be distinguished: from databases, transaction data, unstructured content of emails and documents, data from devices and sensors. However, the use of data from social media is lower as in their activity they reach for analytics, not only in the administrative and business but also in the clinical area. It clearly shows that the decisions made in medical facilities are highly data-driven. The results of the study confirm what has been analyzed in the literature that medical facilities are moving towards data-based healthcare, together with its benefits.","Kornelia Batko,Kornelia Batko,Andrzej Ślęzak,Andrzej Ślęzak",Journal of Big Data,2022
10.1201/9780429196614-7,,,Big Data Analytics,"Big data are extremely large data sets that are so complex and unorganized. These large data sets are analyzed computationally to reveal patterns, trends related to human behavior and interactions. The three types of data are structured, semi-structured, and unstructured. Every big data has played a vital role in fighting COVID-19. Many countries used big data that helped them to reduce cross-infections, allowing the countries to get back to work and stabilize their economy. Big data was used to collect information for different other types of health crises also earlier. Artificial intelligence and machine learning involve many other types of novel data like images, movies, audio, and so many other things that don’t fit into standard relational databases; that’s the variety of big data where AI has been so useful. There are a lot of data science tools to help in analysis. Windows Azure is a Spark and Hadoop service in the cloud. It offers good enterprise-grade security.","Sujni Paul,Sujni Paul",Lecture Notes in Computer Science,2020
10.1080/01972243.2017.1354593,,,Weapons of Math Destruction: How Big Data Increases Inequality and Threatens Democracy,"Weapons of Math Destruction presents a careful and sustained criticism of big data's dark side, the remarkable ability if its algorithms to “calculat[e] our potential as students, workers, lovers, ...","Tony Doyle,Tony Doyle",The Information Society,2017
10.1080/1369118x.2012.678878,,,CRITICAL QUESTIONS FOR BIG DATA,"The era of Big Data has begun. Computer scientists, physicists, economists, mathematicians, political scientists, bio-informaticists, sociologists, and other scholars are clamoring for access to the massive quantities of information produced by and about people, things, and their interactions. Diverse groups argue about the potential benefits and costs of analyzing genetic sequences, social media interactions, health records, phone logs, government records, and other digital traces left by people. Significant questions emerge. Will large-scale search data help us create better tools, services, and public goods? Or will it usher in a new wave of privacy incursions and invasive marketing? Will data analytics help us understand online communities and political movements? Or will it be used to track protesters and suppress speech? Will it transform how we study human communication and culture, or narrow the palette of research options and alter what ‘research’ means? Given the rise of Big Data as a socio-tech...","danah boyd,danah boyd,Kate Crawford,Kate Crawford","Information, Communication & Society",2012
10.14569/ijacsa.2016.070267,,,"A Survey on Big Data Analytics: Challenges, Open Research Issues and Tools","A huge repository of terabytes of data is generated each day from modern information systems and digital technolo-gies such as Internet of Things and cloud computing. Analysis of these massive data requires a lot of efforts at multiple levels to extract knowledge for decision making. Therefore, big data analysis is a current area of research and development. The basic objective of this paper is to explore the potential impact of big data challenges, open research issues, and various tools associated with it. As a result, this article provides a platform to explore big data at numerous stages. Additionally, it opens a new horizon for researchers to develop the solution, based on the challenges and open research issues.","D. P. Acharjya,D. P. Acharjya,D. P. Acharjya,Kauser Ahmed P,Kauser Ahmed P",International Journal of Advanced Computer Science and Applications,2016
10.2139/ssrn.2477899,,,Big Data's Disparate Impact,"Advocates of algorithmic techniques like data mining argue that these techniques eliminate human biases from the decision-making process. But an algorithm is only as good as the data it works with. Data is frequently imperfect in ways that allow these algorithms to inherit the prejudices of prior decision makers. In other cases, data may simply reflect the widespread biases that persist in society at large. In still others, data mining can discover surprisingly useful regularities that are really just preexisting patterns of exclusion and inequality. Unthinking reliance on data mining can deny historically disadvantaged and vulnerable groups full participation in society. Worse still, because the resulting discrimination is almost always an unintentional emergent property of the algorithm’s use rather than a conscious choice by its programmers, it can be unusually hard to identify the source of the problem or to explain it to a court.This Essay examines these concerns through the lens of American antidiscrimination law — more particularly, through Title VII’s prohibition of discrimination in employment. In the absence of a demonstrable intent to discriminate, the best doctrinal hope for data mining’s victims would seem to lie in disparate impact doctrine. Case law and the Equal Employment Opportunity Commission’s Uniform Guidelines, though, hold that a practice can be justified as a business necessity when its outcomes are predictive of future employment outcomes, and data mining is specifically designed to find such statistical correlations. Unless there is a reasonably practical way to demonstrate that these discoveries are spurious, Title VII would appear to bless its use, even though the correlations it discovers will often reflect historic patterns of prejudice, others’ discrimination against members of protected groups, or flaws in the underlying dataAddressing the sources of this unintentional discrimination and remedying the corresponding deficiencies in the law will be difficult technically, difficult legally, and difficult politically. There are a number of practical limits to what can be accomplished computationally. For example, when discrimination occurs because the data being mined is itself a result of past intentional discrimination, there is frequently no obvious method to adjust historical data to rid it of this taint. Corrective measures that alter the results of the data mining after it is complete would tread on legally and politically disputed terrain. These challenges for reform throw into stark relief the tension between the two major theories underlying antidiscrimination law: anticlassification and antisubordination. Finding a solution to big data’s disparate impact will require more than best efforts to stamp out prejudice and bias; it will require a wholesale reexamination of the meanings of “discrimination” and “fairness.”","Solon Barocas,Solon Barocas,Andrew D. Selbst,Andrew D. Selbst",California Law Review,2016
