DOI,PMID,arXiv ID,Title,Abstract,Authors,Journal,Year
10.1038/s41568-022-00502-0,36064595,,Big data in basic and translational cancer research,"Historically, the primary focus of cancer research has been molecular and clinical studies of a few essential pathways and genes. Recent years have seen the rapid accumulation of large-scale cancer omics data catalysed by breakthroughs in high-throughput technologies. This fast data growth has given rise to an evolving concept of ‘big data’ in cancer, whose analysis demands large computational resources and can potentially bring novel insights into essential questions. Indeed, the combination of big data, bioinformatics and artificial intelligence has led to notable advances in our basic understanding of cancer biology and to translational advancements. Further advances will require a concerted effort among data scientists, clinicians, biologists and policymakers. Here, we review the current state of the art and future challenges for harnessing big data to advance cancer research and treatment.","Peng Jiang,Peng Jiang,Sanju Sinha,Sanju Sinha,Sanju Sinha,Kenneth Aldape,Kenneth Aldape,Kenneth Aldape,Sridhar Hannenhalli,Sridhar Hannenhalli,Cenk Sahinalp,S. Cenk Sahinalp,Eytan Ruppin,Eytan Ruppin",Nature Reviews Cancer,2022
10.1016/j.agsy.2017.01.023,,,Big Data in Smart Farming – A review,"Smart Farming is a development that emphasizes the use of information and communication technology in the cyber-physical farm management cycle. New technologies such as the Internet of Things and Cloud Computing are expected to leverage this development and introduce more robots and artificial intelligence in farming. This is encompassed by the phenomenon of Big Data, massive volumes of data with a wide variety that can be captured, analysed and used for decision-making. This review aims to gain insight into the state-of-the-art of Big Data applications in Smart Farming and identify the related socio-economic challenges to be addressed. Following a structured approach, a conceptual framework for analysis was developed that can also be used for future studies on this topic. The review shows that the scope of Big Data applications in Smart Farming goes beyond primary production; it is influencing the entire food supply chain. Big data are being used to provide predictive insights in farming operations, drive real-time operational decisions, and redesign business processes for game-changing business models. Several authors therefore suggest that Big Data will cause major shifts in roles and power relations among different players in current food supply chain networks. The landscape of stakeholders exhibits an interesting game between powerful tech companies, venture capitalists and often small start-ups and new entrants. At the same time there are several public institutions that publish open data, under the condition that the privacy of persons must be guaranteed. The future of Smart Farming may unravel in a continuum of two extreme scenarios: 1) closed, proprietary systems in which the farmer is part of a highly integrated food supply chain or 2) open, collaborative systems in which the farmer and every other stakeholder in the chain network is flexible in choosing business partners as well for the technology as for the food production side. The further development of data and application infrastructures (platforms and standards) and their institutional embedment will play a crucial role in the battle between these scenarios. From a socio-economic perspective, the authors propose to give research priority to organizational issues concerning governance issues and suitable business models for data sharing in different supply chain scenarios.","Sjaak Wolfert,Sjaak Wolfert,Lan Ge,Lan Ge,C.N. Verdouw,C.N. Verdouw,M.J. Bogaardt,Marc Jeroen Bogaardt",Agricultural Systems,2017
10.1021/acs.chemrev.0c00004,32520531,2001.06728,Big-Data Science in Porous Materials: Materials Genomics and Machine Learning,"By combining metal nodes with organic linkers we can potentially synthesize millions of possible metal organic frameworks (MOFs). At present, we have libraries of over ten thousand synthesized materials and millions of in-silico predicted materials. The fact that we have so many materials opens many exciting avenues to tailor make a material that is optimal for a given application. However, from an experimental and computational point of view we simply have too many materials to screen using brute-force techniques. In this review, we show that having so many materials allows us to use big-data methods as a powerful technique to study these materials and to discover complex correlations. The first part of the review gives an introduction to the principles of big-data science. We emphasize the importance of data collection, methods to augment small data sets, how to select appropriate training sets. An important part of this review are the different approaches that are used to represent these materials in feature space. The review also includes a general overview of the different ML techniques, but as most applications in porous materials use supervised ML our review is focused on the different approaches for supervised ML. In particular, we review the different method to optimize the ML process and how to quantify the performance of the different methods. In the second part, we review how the different approaches of ML have been applied to porous materials. In particular, we discuss applications in the field of gas storage and separation, the stability of these materials, their electronic properties, and their synthesis. The range of topics illustrates the large variety of topics that can be studied with big-data science. Given the increasing interest of the scientific community in ML, we expect this list to rapidly expand in the coming years.","Kevin Maik Jablonka,Daniele Ongari,Seyed Mohamad Moosavi,Berend Smit",arXiv: Materials Science,2020
10.1109/access.2021.3102227,,,Big Data and AI Revolution in Precision Agriculture: Survey and Challenges,"Sustainable agricultural development is a significant solution with fast population development through the use of information and communication (ICT) in precision agriculture, which produced new methods for making cultivation further productive, proficient, well-regulated while preserving the climate. Big data (machine learning, deep learning, etc.) is amongst the vital technologies of ICT employed in precision agriculture for their huge data analytical capabilities to abstract significant information and to assist agricultural practitioners to comprehend well farming practices and take precise decisions. The main goal of this article is to acquire an awareness of the Big Data latest applications in smart agriculture and be acquainted with related social and financial challenges to be concentrated on. This article features data creation methods, accessibility of technology, accessibility of devices, software tools, and data analytic methods, and appropriate applications of big data in precision agriculture. Besides, there are still a few challenges that come across the widespread implementation of big data technology in agriculture.","Showkat Ahmad Bhat,Showkat Ahmad Bhat,Nen-Fu Huang,Nen-Fu Huang,Nen-Fu Huang",IEEE Access,2021
10.1109/access.2020.2980942,,,Analysis of Dimensionality Reduction Techniques on Big Data,"Due to digitization, a huge volume of data is being generated across several sectors such as healthcare, production, sales, IoT devices, Web, organizations. Machine learning algorithms are used to uncover patterns among the attributes of this data. Hence, they can be used to make predictions that can be used by medical practitioners and people at managerial level to make executive decisions. Not all the attributes in the datasets generated are important for training the machine learning algorithms. Some attributes might be irrelevant and some might not affect the outcome of the prediction. Ignoring or removing these irrelevant or less important attributes reduces the burden on machine learning algorithms. In this work two of the prominent dimensionality reduction techniques, Linear Discriminant Analysis (LDA) and Principal Component Analysis (PCA) are investigated on four popular Machine Learning (ML) algorithms, Decision Tree Induction, Support Vector Machine (SVM), Naive Bayes Classifier and Random Forest Classifier using publicly available Cardiotocography (CTG) dataset from University of California and Irvine Machine Learning Repository. The experimentation results prove that PCA outperforms LDA in all the measures. Also, the performance of the classifiers, Decision Tree, Random Forest examined is not affected much by using PCA and LDA.To further analyze the performance of PCA and LDA the eperimentation is carried out on Diabetic Retinopathy (DR) and Intrusion Detection System (IDS) datasets. Experimentation results prove that ML algorithms with PCA produce better results when dimensionality of the datasets is high. When dimensionality of datasets is low it is observed that the ML algorithms without dimensionality reduction yields better results.","Thippa Reddy Gadekallu,G. Thippa Reddy,G. Thippa Reddy,Praveen Kumar Reddy Maddikunta,Praveen Kumar Reddy Maddikunta,M. Praveen Kumar Reddy,Kuruva Lakshmanna,Kuruva Lakshmanna,Kuruva Lakshmanna,Rajesh Kaluri,Rajesh Kaluri,Dharmendra Singh Rajput,Dharmendra Singh Rajput,Gautam Srivastava,Gautam Srivastava,Thar Baker,Thar Baker",IEEE Access,2020
10.1186/2047-2501-2-3,25825667,,Big data analytics in healthcare: promise and potential,"Objective: To describe the promise and potential of big data analytics in healthcare. Methods: The paper describes the nascent field of big data analytics in healthcare, discusses the benefits, outlines an architectural framework and methodology, describes examples reported in the literature, briefly discusses the challenges, and offers conclusions. Results: The paper provides a broad overview of big data analytics for healthcare researchers and practitioners. Conclusions: Big data analytics in healthcare is evolving into a promising field for providing insight from very large data sets and improving outcomes while reducing costs. Its potential is great; however there remain challenges to overcome.","Wullianallur Raghupathi,Wullianallur Raghupathi,Viju Raghupathi,Viju Raghupathi",Health Information Science and Systems,2014
10.1093/aje/kwv254,26994063,,Using Big Data to Emulate a Target Trial When a Randomized Trial Is Not Available,"Abstract Ideally, questions about comparative effectiveness or safety would be answered using an appropriately designed and conducted randomized experiment. When we cannot conduct a randomized experiment, we analyze observational data. Causal inference from large observational databases (big data) can be viewed as an attempt to emulate a randomized experiment-the target experiment or target trial-that would answer the question of interest. When the goal is to guide decisions among several strategies, causal analyses of observational data need to be evaluated with respect to how well they emulate a particular target trial. We outline a framework for comparative effectiveness research using big data that makes the target trial explicit. This framework channels counterfactual theory for comparing the effects of sustained treatment strategies, organizes analytic approaches, provides a structured process for the criticism of observational studies, and helps avoid common methodologic pitfalls.","Miguel A. Hernán,Miguel A. Hernán,James M. Robins,James M. Robins",American Journal of Epidemiology,2016
10.1109/tkde.2013.109,,,Data Mining with Big Data,"Big Data concern large-volume, complex, growing data sets with multiple, autonomous sources. With the fast development of networking, data storage, and the data collection capacity, Big Data are now rapidly expanding in all science and engineering domains, including physical, biological and biomedical sciences. This paper presents a HACE theorem that characterizes the features of the Big Data revolution, and proposes a Big Data processing model, from the data mining perspective. This data-driven model involves demand-driven aggregation of information sources, mining and analysis, user interest modeling, and security and privacy considerations. We analyze the challenging issues in the data-driven model and also in the Big Data revolution.","K. V. S. N. Raju,Kvvn Raju,Kalsanisravan Kumar",International Journal of Research,2016
10.1093/rfs/hhab038,,,Big Data in Finance,"Big data is revolutionizing the finance industry and has the potential to significantly shape future research in finance. This special issue contains articles following the 2019 NBER/ RFS conference on big data. In this Introduction to the special issue, we define the “Big Data” phenomenon as a combination of three features: large size, high dimension, and complex structure. Using the articles in the special issue, we discuss how new research builds on these features to push the frontier on fundamental questions across areas in finance – including corporate finance, market microstructure, and asset pricing. Finally, we offer some thoughts for future research directions.","Itay Goldstein,Itay Goldstein,Chester S. Spatt,Chester S. Spatt,Mao Ye,Mao Ye",Review of Financial Studies,2021
10.1016/j.jbusres.2016.08.001,,,Critical analysis of Big Data challenges and analytical methods,"Big Data (BD), with their potential to ascertain valued insights for enhanced decision-making process, have recently attracted substantial interest from both academics and practitioners. Big Data Analytics (BDA) is increasingly becoming a trending practice that many organizations are adopting with the purpose of constructing valuable information from BD. The analytics process, including the deployment and use of BDA tools, is seen by organizations as a tool to improve operational efficiency though it has strategic potential, drive new revenue streams and gain competitive advantages over business rivals. However, there are different types of analytic applications to consider. Therefore, prior to hasty use and buying costly BD tools, there is a need for organizations to first understand the BDA landscape. Given the significant nature of the BD and BDA, this paper presents a state-of-the-art review that presents a holistic view of the BD challenges and BDA methods theorized/proposed/employed by organizations to help others understand this landscape with the objective of making robust investment decisions. In doing so, systematically analysing and synthesizing the extant research published on BD and BDA area. More specifically, the authors seek to answer the following two principal questions: Q1 – What are the different types of BD challenges theorized/proposed/confronted by organizations? and Q2 – What are the different types of BDA methods theorized/proposed/employed to overcome BD challenges?. This systematic literature review (SLR) is carried out through observing and understanding the past trends and extant patterns/themes in the BDA research area, evaluating contributions, summarizing knowledge, thereby identifying limitations, implications and potential further research avenues to support the academic community in exploring research themes/patterns. Thus, to trace the implementation of BD strategies, a profiling method is employed to analyze articles (published in English-speaking peer-reviewed journals between 1996 and 2015) extracted from the Scopus database. The analysis presented in this paper has identified relevant BD research studies that have contributed both conceptually and empirically to the expansion and accrual of intellectual wealth to the BDA in technology and organizational resource management discipline.","Uthayasankar Sivarajah,Uthayasankar Sivarajah,Muhammad Mustafa Kamal,Muhammad Mustafa Kamal,Zahir Irani,Zahir Irani,Vishanth Weerakkody,Vishanth Weerakkody",Journal of Business Research,2017
10.1186/s40537-021-00468-0,,,Big data quality framework: a holistic approach to continuous quality management,"Abstract Big Data is an essential research area for governments, institutions, and private agencies to support their analytics decisions. Big Data refers to all about data, how it is collected, processed, and analyzed to generate value-added data-driven insights and decisions. Degradation in Data Quality may result in unpredictable consequences. In this case, confidence and worthiness in the data and its source are lost. In the Big Data context, data characteristics, such as volume, multi-heterogeneous data sources, and fast data generation, increase the risk of quality degradation and require efficient mechanisms to check data worthiness. However, ensuring Big Data Quality (BDQ) is a very costly and time-consuming process, since excessive computing resources are required. Maintaining Quality through the Big Data lifecycle requires quality profiling and verification before its processing decision. A BDQ Management Framework for enhancing the pre-processing activities while strengthening data control is proposed. The proposed framework uses a new concept called Big Data Quality Profile. This concept captures quality outline, requirements, attributes, dimensions, scores, and rules. Using Big Data profiling and sampling components of the framework, a faster and efficient data quality estimation is initiated before and after an intermediate pre-processing phase. The exploratory profiling component of the framework plays an initial role in quality profiling; it uses a set of predefined quality metrics to evaluate important data quality dimensions. It generates quality rules by applying various pre-processing activities and their related functions. These rules mainly aim at the Data Quality Profile and result in quality scores for the selected quality attributes. The framework implementation and dataflow management across various quality management processes have been discussed, further some ongoing work on framework evaluation and deployment to support quality evaluation decisions conclude the paper.","Ikbal Taleb,Ikbal Taleb,Mohamed Adel Serhani,Mohamed Adel Serhani,Chafik Bouhaddioui,Chafik Bouhaddioui,Rachida Dssouli,Rachida Dssouli",Journal of Big Data,2021
10.1186/s40779-021-00338-z,34380547,,"Data mining in clinical big data: the frequently used databases, steps, and methodological models.","Many high quality studies have emerged from public databases, such as Surveillance, Epidemiology, and End Results (SEER), National Health and Nutrition Examination Survey (NHANES), The Cancer Genome Atlas (TCGA), and Medical Information Mart for Intensive Care (MIMIC); however, these data are often characterized by a high degree of dimensional heterogeneity, timeliness, scarcity, irregularity, and other characteristics, resulting in the value of these data not being fully utilized. Data-mining technology has been a frontier field in medical research, as it demonstrates excellent performance in evaluating patient risks and assisting clinical decision-making in building disease-prediction models. Therefore, data mining has unique advantages in clinical big-data research, especially in large-scale medical public databases. This article introduced the main medical public database and described the steps, tasks, and models of data mining in simple language. Additionally, we described data-mining methods along with their practical applications. The goal of this work was to aid clinical researchers in gaining a clear and intuitive understanding of the application of data-mining technology on clinical big-data in order to promote the production of research results that are beneficial to doctors and patients.","Wentao Wu,Wen-Tao Wu,Yuan-Jie Li,Yuanjie Li,Aozi Feng,Aozi Feng,Li Li,Li Li,Tao Huang,Tao Huang,Anding Xu,Anding Xu,Jun Lyu,Jun Lyu",Military Medical Research,2021
10.3390/bdcc6010017,,,Big Data Analytics in Supply Chain Management: A Systematic Literature Review and Research Directions,"Big data analytics has been successfully used for various business functions, such as accounting, marketing, supply chain, and operations. Currently, along with the recent development in machine learning and computing infrastructure, big data analytics in the supply chain are surging in importance. In light of the great interest and evolving nature of big data analytics in supply chains, this study conducts a systematic review of existing studies in big data analytics. This study presents a framework of a systematic literature review from interdisciplinary perspectives. From the organizational perspective, this study examines the theoretical foundations and research models that explain the sustainability and performances achieved through the use of big data analytics. Then, from the technical perspective, this study analyzes types of big data analytics, techniques, algorithms, and features developed for enhanced supply chain functions. Finally, this study identifies the research gap and suggests future research directions.","In Lee,In Lee,George Mangalaraj,George Mangalaraj",Big data and cognitive computing,2022
,,,"Big Data: A Revolution That Will Transform How We Live, Work, and Think",,Kenneth Cukier,,2015
10.1109/tits.2014.2345663,,,Traffic Flow Prediction With Big Data: A Deep Learning Approach,"Accurate and timely traffic flow information is important for the successful deployment of intelligent transportation systems. Over the last few years, traffic data have been exploding, and we have truly entered the era of big data for transportation. Existing traffic flow prediction methods mainly use shallow traffic prediction models and are still unsatisfying for many real-world applications. This situation inspires us to rethink the traffic flow prediction problem based on deep architecture models with big traffic data. In this paper, a novel deep-learning-based traffic flow prediction method is proposed, which considers the spatial and temporal correlations inherently. A stacked autoencoder model is used to learn generic traffic flow features, and it is trained in a greedy layerwise fashion. To the best of our knowledge, this is the first time that a deep architecture model is applied using autoencoders as building blocks to represent traffic flow features for prediction. Moreover, experiments demonstrate that the proposed method for traffic flow prediction has superior performance.","Yisheng Lv,Yisheng Lv,Yanjie Duan,Yanjie Duan,Wenwen Kang,Wenwen Kang,Zhengxi Li,Zhengxi Li,Fei‐Yue Wang,Fei-Yue Wang,Fei-Yue Wang",IEEE Transactions on Intelligent Transportation Systems,2015
10.1007/s00170-017-0233-1,,,"Digital twin-driven product design, manufacturing and service with big data","Nowadays, along with the application of new-generation information technologies in industry and manufacturing, the big data-driven manufacturing era is coming. However, although various big data in the entire product lifecycle, including product design, manufacturing, and service, can be obtained, it can be found that the current research on product lifecycle data mainly focuses on physical products rather than virtual models. Besides, due to the lack of convergence between product physical and virtual space, the data in product lifecycle is isolated, fragmented, and stagnant, which is useless for manufacturing enterprises. These problems lead to low level of efficiency, intelligence, sustainability in product design, manufacturing, and service phases. However, physical product data, virtual product data, and connected data that tie physical and virtual product are needed to support product design, manufacturing, and service. Therefore, how to generate and use converged cyber-physical data to better serve product lifecycle, so as to drive product design, manufacturing, and service to be more efficient, smart, and sustainable, is emphasized and investigated based on our previous study on big data in product lifecycle management. In this paper, a new method for product design, manufacturing, and service driven by digital twin is proposed. The detailed application methods and frameworks of digital twin-driven product design, manufacturing, and service are investigated. Furthermore, three cases are given to illustrate the future applications of digital twin in the three phases of a product respectively.","Fei Tao,Fei Tao,Jiangfeng Cheng,Jiangfeng Cheng,Qinglin Qi,Qinglin Qi,Meng Zhang,Meng Zhang,Meng Zhang,He Zhang,He Zhang,Fangyuan Sui,Fangyuan Sui",The International Journal of Advanced Manufacturing Technology,2018
